Movie Names,Certificate,Duration,Genre,Rating,Years,Director,Actors,Gross,Votes
Hind Ki Beti,None,,Action,,1996,Joginder Shelly,"Shagufta Ali, Arun Bakshi, Ramesh Bhatkar, Poonam Dasgupta",,
Savay,None,,Short,,2018,Nishant Adhagale,Sanket Vishwasrao,,
Bhuvana Kaadu,None,,Thriller,,2013,V.M. Mohan,"Pandu, Nizhalgal Ravi",,
Pratima,None,,None,,1987,,Munin Barua,,
Garigar,None,,Comedy,,,Vikas Baikar,"Tanaji Galgunde, Vijay Patkar, Pooja Jaiswal",,
Akshinthalu,None,,Drama,,1987,Mouli,"Kalyan Chakravarthy Nandamuri, Poornima, Ramya Krishnan, Gollapudi Maruthi Rao",,
kall karo sambhal ke,None,,Short,,2017,Sudhir Achary,Vijay Patkar,,
Usha,None,122,None,,1935,Baburao Painter,"Usha Mantri, Govindrao Tembe, Ratnaprabha, K. Vasudeo",,
Boba Bondhu,None,,"Short, Drama",,2022,,,,
Happenstance,None,6,Short,,2008,Siddharth Khaitan,Vijay Maurya,,
Kasthuri Nivasa (Kannada),None,22,Drama,,2019,,"Risha Nijaguna, Dileep R. Shetty, Asha Rani, Pavan Acharya",,
Phull: Dharampreet & Sudesh Kumari,None,,"Short, Romance",,2008,Simar Pangli,"Dharampreet, Kamal",,
Sonetara,None,,None,,1973,Nip Barua,Arun Nath,,
Yenti Raja Youth Ilaa Undi,None,152,Thriller,,2019,,"Sakshi Chaudhary, Krishna Murali Posani, Jabardasth Appa Rao",,
Love Eternal,None,,"Short, Drama",,2013,Sudhir Achary,"Priyamvada Kant, Danish Bhatt",,
Naagmati Naagwallo,None,,None,,1984,,,,
Naastik (believe to belief),None,,"Short, Drama",,2019,Vishal Kashyap,"K.K. Gautam, Harshini Parikh, Riddhi Patel, Yuvraj Singh",,
Minnal Veeran,None,,None,,1954,,"K.R. Ramsingh, Ranjan, Sandhya",,
Rajan Paranja Katha,None,,None,,1978,M.S. Mani,"Abubakkar, Kaviyoor Ponnamma, Jose Prakash, Sankaradi",,
Buddha Mil Gaya,None,,"Short, Romance",,2005,,Rakhi Sawant,,
MTV Tresemme Picture Perfect,None,45,Drama,,2015,,"Diyali Chauhan, Giovana Echeverria",,
Baa Baa Black Sheep and Many More Kids Songs,None,,Animation,,2014,,,,
Ninagai Nanu,None,,None,,1975,,C.V. Sridhar,,
Meera Jaakirathai,None,106,Horror,3.6,2016,R.G. Kesavan,"Surendar, Joy, Mounika, Sri Priya",,17
God Bless Internet,None,2,"Short, Drama",,2018,Aalim Rushdy,"Chetan Malhotra, Chetan Sehtya",,
Charminar Boys,None,,Romance,,2006,Basit Khan,"Rajol Gandhi, Ashraf Khan, Kumail Khan, Rahul Roy",,
Aranya Rodana,None,14,"Documentary, Short",,2018,,Ranjit,,
Mamlar Phal,None,,None,,1956,,Pashupati Chatterjee,,
Nathicharami,None,,Drama,,2017,,"Bhanupriya, Sirisha, Suresh",,
Pathrai Aankhon Ke Sapne,None,,Drama,,1999,,"Annu Kapoor, Sukanya Kulkarni, Smriti Mishra",,
Jungle Jackie,None,,"Action, Romance",,2013,Ravi Kadooru,"Rajesh, Aishwarya, Bullet Prakash, Raju Talikote",,
Chasing Dreams,None,24,"Documentary, Short, Sport",,2018,,Vaishali Kendale,,
The Seventh Wish,None,28,"Documentary, Short, History",,2014,Varun Trikha,Gulista Gul,,
Navjeevan,None,,None,,1935,,Mohan Dayaram Bhavnani,,
Diljit Dosanjh: Black & White,None,3,Music,,2021,Rahul Dutta,"Elwa Saleh, Diljit Dosanjh, Elwa",,
Bhaubeej,None,,None,,1955,Rajan Kumar,"Chandrakant, Sulochana Latkar, Leela Mehta, Suryakant",,
Jalta Hai Jiya Mera,None,,"Short, Music, Romance",,2005,,Negar Khan,,
Bhaavna,None,,Drama,,1972,Karunesh Thakur,"Dev Dutt, Padma Khanna, Dev Kumar, Shyam Kumar",,
Tomar Sporsho Cheyechi,None,,"Short, Romance",,2020,Subrata Acharya,"Anirban Chatterjee, Abanti Das",,
Tarana - The Black Story,None,,Thriller,,2018,Sanoj Mishra,"Vishal Malhotra, Urmay Rathod, Ruchika, Ankush Salgotra",,
Mission to Empower - Village Based Rehabilitation Initiative,None,9,"Documentary, Short",,2019,,Arin Paul,,
Aalavattam,None,,None,6.3,1993,Raju Ambaran,"Devan, Ilavarasi, Innocent, Prem Kumar",,13
Indian Frankie,None,,"Short, Comedy",,2016,Yogesh Mahajan,Kushal Koli,,
The Forest,None,,Horror,,2017,,Tinnu Verma,,
Ek Tuku Basa,None,,Drama,7.9,1965,Tarun Majumdar,"Soumitra Chatterjee, Sandhya Roy, Rabi Ghosh, Anup Kumar",,14
The Expedition,None,,Reality-TV,,2018,,"Sahil Khattar, Priyanka Zemse",,
Iska Kya Karen,None,,Documentary,,1973,,Ram Mohan,,
Marujanma,None,,Drama,,2008,A.R. Babu,"Dimple Chopade, Naga Kiran, Priyanka",,
Silver Jubilee,None,,"Short, Drama",,2017,Rahul rai Gupta,Sushma Bharti,,
Raja Malaya Simhan,None,,None,,1959,,Ranga B.S.,,
The Vulnerable Road User,None,,Documentary,4.5,1991,,Tapan Bose,,34
Jathi Malli,None,159,Drama,6.4,1993,K. Balachander,"Kushboo, Mukesh, Nassar, Vineeth",,50
Now or Forever,None,,"Short, Drama",,2020,Vignesh Rajendran,"Sven Latinovic, Vitoria Porto, Rikin Shah",,
Bambai Ki Mohini,None,,None,,1934,Balwant Bhatt,"Lallo Bhai, Panna Rani",,
Flight to Assam,None,,Drama,,1961,Kamal Sharma,"Rajan Haksar, Shashikala Jawalkar, Rajan Kapoor, Madan Puri",,
Prem Joyare,Not Rated,141,Drama,,1991,Kajal Chakraborty,"Kushal Chakraborty, Ratan Chakraborty, Anupama Chatterjee, Biplab Chatterjee",,
Abhiman,None,,None,7.0,2003,,,,11
We Have a Promise to Keep,None,,"Documentary, Short",,1975,,S.N.S. Sastry,,
C'est la vie,None,6,"Short, Drama, Family",,2017,,Dave Jigar,,
Subho muharat,None,,Talk-Show,,2017,,Prasenjit Chatterjee,,
Their New Roots,None,,Documentary,,1959,,Santi P. Choudhury,,
Experience India,None,20,"Documentary, Short",,1982,,Zafar Hai,,
Dharmadhikari,None,,Action,,1989,,"Amala Akkineni, Mammootty",,
Shiv Bhakat Baba Balak Nath,None,,Drama,,1972,Avatar,"Sulochana Chatterjee, Jayshree Gadkar, Maruti, Babu Raje",,
Mangalya Bandham,Not Rated,130,None,,1985,,"Chandramohan, Suhasini, Suman",,
After the Last Lecture,None,,Romance,,,,"Hemwant Tiwari, Rahul Sinha, Yashveer Choudhary",,
Gussa (Album B.A.E 2021),None,,"Short, Music",,2021,,,,
Chhat Pe,None,128,Romance,,2007,Dinesh Chaudhary,"Pushpa Gosai, Uttar Kumar, Mukesh Sharma, Rakhi Tomer",,
Sharing is caring,None,,"Short, Drama",,2017,Jimmy Gidderbaha,"Gagan, Daksh Vijan",,
Graher Pher,None,,Drama,,1937,Charu Roy,"Manoranjan Bhattacharya, Jogesh Choudhury, Devbala, Manorama Devi",,
The society stories,None,,"Short, Comedy, Thriller",,2022,Phoenix,"Ankit, Anubhav, Dikshant, Lekhraj",,
Sandra Beds Sandeep,None,121,"Comedy, Drama, Romance",,2018,Prashant Rai,"Rakesh Bedi, Ashutosh Patki, Roaley Ryan, Ankush Deshmukh",,
Men in White: Virtus in Arduis,None,,"Documentary, Short",,2017,,,,
Jwala,None,135,None,,1969,M. Krishnan Nair,"Adoor Bhasi, Sunil Dutt, N. Govindankutty, Manavalan Joseph",,
Preyasi,None,,None,,2002,Jayadevan,Sindhu,,
Shyamalachechi,None,,None,,1965,P. Bhaskaran,"Ambika, Bahadur, Pappukutty Bhagavathar, Adoor Bhasi",,
Rahim Murge pe mat ro,None,1,"Short, Biography",7.0,2008,"Devashish Makhija, 
Rajat Nagpal",Piyush Mishra,,9
Cancer,None,27,"Short, Drama, Romance",,2018,Pawan Kumar Nayak,Bharati Perwani,,
And I Make Short Films,None,16,"Documentary, Short",7.4,1968,,S.N.S. Sastry,,16
Rozana: Be Selfless in love,None,,Short,,2017,Shraddha Shah,Rajeev Vashishth,,
Saptapadi,None,,None,,2018,,,,
The Wardrobe,None,,"Short, Horror",,2021,Jay Sondagar,"Sondagar Hirva, Jay Sondagar, Rajni Sondagar",,
Al-Bateen,None,16,Short,,2013,"Nikunj Hota, 
Plaban Mohanty","Deb, Suraj Mohapatra",,
Mrityu Panjaradalli Goodarachari 555,Not Rated,131,None,,1970,A. Sunanda Raj,"K.S. Ashwath, T.N. Balakrishna, Advani Lakshmi Devi, Gopal",,
Upnyaas,None,,Thriller,,,Rahul Kumar Shukla,"Anurekha Bhagat, Rahul Kumar Shukla, Aditya Lakhia, Pooja Dikshit",,
Amma,None,22,Drama,,2016,,,,
"Bakso, A mysterious box",None,27,"Short, Thriller",,2021,"Rony Babu, 
Elora B.","Elora B., Rony Babu, Santanu Das, Ujjwal Ghosh",,
Bandhalu Anubhandhalu,None,,None,,1974,,Rao C.S.R.,,
Mayer Pran,None,,None,,1941,P.C. Barua,"Kanu Bannerjee, Nirmal Bannerjee, P.C. Barua, Jiben Bose",,
Lal Nishan,None,,Drama,,1959,,"Master Bhagwan, Daljeet, Radhika",,
Naari,None,6,"Short, Music",,2017,,Ravi Davala,,
Cruising Legends,None,,Short,,2017,,"Urvashi Patole, Vir Nakai, Rohith Subramanian, Atul Warrier",,
Dil Me Tum Hi Ho,None,,Family,,2021,Shakil. S. Saifee,"Arihant Jain, Sameer Khan, Sezal Sharma",,
Ae Nuhen Kahani,None,,Drama,,1977,K.H.D. Rao,"Chakrapani, Sachi Das, Madhumita, Basant Mahapatra",,
Youth Future,None,132,Drama,,2018,Balwant Singh Suri,"Preet Jitpal, Victor John, Rupa Khurana",,
Salvo 2020,None,,Short,,2020,Amritya Bhattacharya,"Mayank Ronyy, Amritya Bhattacharya, Shweta Chauhan",,
Independence Day,None,,Drama,,2000,A.R. Ramesh,"Alphonsa, Anandraj, C. Arunpandian, Mukhyamantri Chandru",,
Mother,None,,Short,,2016,"Annapareddy Promode Vbr, 
Srikanth Vbr","Harshitha Poosapati, Swathi Poosapati",,
Raj Mahal,None,,None,4.1,1972,,Sridevi,,9
Qurbani: The Sacrifice,None,,Action,,2001,,"Manya, Shivaji",,
Cool Ganesha,None,,Drama,,2013,Vasanth,"Akshay Gundlupete, Jaggesh, Tashu Kaushik, Girija Lokesh",,
Matris Silent Saga,None,10,"Short, Drama",,2014,Manoj Gautam,"Geeta Guha, Swagat Mali, Manish Pal Singh",,
Padipoyaa Neemayalo,None,,None,7.3,2017,R.K. Kampally,"Arun Gupta, Saveri",,6
Five Star Hospital,None,,Drama,4.3,1997,Thaha,"Vishnu, Jagadish, Jagathi Sreekumar, Mala Aravindan",,33
Majnoon,None,,"Crime, Drama, Music",,2003,Ashish Chanana,"Ashish Chanana, Sucheta Khanna",,
Sarbajan,None,,None,,1985,,"Moloya Goswami, Arun Nath",,
Thayyareduppu,None,,"Short, Drama",,2015,Mahesh Krishnan,"Mahesh Krishnan, Arun Sudarshan",,
Unto an Evil Counsellor,None,74,Thriller,,,Nishaant Singh Bhinder,Anmol Sidhu,,
Bindiya,None,,"Drama, Family",,1955,Shamim Bhagat,"Shekhar, Sulochana Latkar, Kumkum, Leela Mishra",,
Chup Kie Asuchi...,None,,Thriller,,2009,Biswa Bhusan Mohapatra,"Bhranti, Biswajeet, Jaya Biswas, Sunil Kumar",,
Business Is People,None,,None,,1976,,Bhimsain,,
Fit India,None,19,"Short, Comedy",,2020,Rajeev Barnwal,"Priyanka Bedi, Menka Hemrajani, Akshaya Naik, Aakash Talwar",,
Pale Blue Dot,None,99,Mystery,,2017,Girish Mohite,"Mangesh Desai, Dipti Dhotre, Umesh Bolke, Mangesh Desai",,
Donear Commercial,None,,Short,,2011,Abhijit Bhattacharya,"Suresh Oberoi, Vivek Oberoi",,
Viruthachalam,None,,None,,2017,Rattan Ganapathy,"Nellai Siva, Swetha, Viruthagiri",,
Life,None,13,"Short, Drama, Mystery",,2018,Visalat Dada,"Aashna Elizabeth Korula, Visalat Dada",,
Berklee,None,,None,,,Sumant Kranthi,"Simran Natekar, Charan Raj, Shruthi, Santhosh Balaraj",,
The Eyes,None,,Horror,,1998,George Kithu,"Pradap Chandran, Devan, Vikram Vanivishwanath",,
Funtastic Quiz,None,3,Game-Show,,2021,,Manish Paul,,
Spring Water,None,4,"Documentary, Short, Adventure",,2015,Raja Dwivedi,"Jagruti Prakash More, Tulasi Yadav, Salim Saikh, Kayum Tamboli",,
Virunnukari,None,,None,,1969,Venu,"Ambika, P.J. Anthony, Kaduvakkulam Antony, Adoor Bhasi",,
Heer Syal,None,,None,,1960,,Shanti Prakash Bakshi,,
Khun Ro Tiko,None,,Action,,1993,,"Jagdeep, Kiran Kumar",,
The Continent of Love,None,10,"Documentary, Short",,1968,,Buddhadev Dasgupta,,
Poloridez,None,,Reality-TV,,2016,,"Saransh Mohite, Vrushali Kulkarni",,
#HomeCredit - Ad,None,,"Short, Drama",,2019,,Aishwarya Kandpal,,
Jaanmoni 2,None,,"Musical, Romance",7.8,2006,Rajesh Bhuyan,"Shyamontika Sharma, Prosenjit Bora, Chandan Kumar Chaudhary, Arun Hazarika",,6
Ariel - Dad's Share the Load Commercial,None,2,Short,,2016,,Shimit Amin,,
Kula Gourava,None,,None,8.8,1971,Sivaram Peketi,"Arathi, Rajkumar, T.R. Narasimharaju, T.N. Balakrishna",,21
Ratna Lutari,None,,None,,1933,,W. Garcher,,
Bathroom Cleaning,None,,Short,,2022,Abhijit Gajwani,"Rasika M, Devesh Satyan, Jayashree Venketaramanan",,
Thedal,None,19,"Documentary, Short",,2017,,Monachan R,,
Girls' School,None,154,None,,1949,Amiya Chakrabarty,"Geeta Bali, Shashikala Jawalkar, Mangla, Sajjan",,
Qafas,None,7,"Short, Thriller",,2019,Rishabh Bhagat,"Divyansh Sharma, Komal Singh",,
Ek Wada Pran Jaaie Par Vachan Na Jaaie,None,138,"Action, Drama",,2011,K. D.,"Rajeev Dinkar, Nizam Khan, Ravi Kishan, Mehak",,
Lakshmi Kalyanam,None,22,Drama,,,,,,
Green Beings,None,,"Documentary, Short",,2012,,Abhinav Gupta,,
Humsaya: The Abutter,None,10,"Short, Horror",,2017,Rahul Ranjan,"Avinash Bhargava, Pavita Ranu Pande",,
Ival Oru Pournami,None,,None,,1988,,Sudha Chandran,,
Can You Imagine,None,,"Short, Comedy, Horror",,2020,Subrata Das,"Raj Dangal, Mithi Nath",,
Beauty Return,None,10,"Short, Drama, Romance",,2017,,Raja Dwivedi,,
4:75 AM,None,,Short,,,Annapareddy Promode Vbr,Abhijit Shroff,,
Tuzyavachun Karmena,None,,Drama,,2016,,"Vignesh Joshi, Abhijeet Amkar, Sai Gharpure",,
Haar Jeet,None,,None,7.9,1940,Amar Mullick,"Kanan Devi, Pahadi Sanyal, Meera Dutta, Chhayadevi",,10
Naa,None,,Animation,4.1,1971,,Bhimsain,,17
Pundalik,None,12,Short,,1912,,"N.G. Chitre, P.R. Tipnis, Ramchandra Gopal Torney",,
Adventures of Malia,None,12,"Animation, Short, Adventure",,2015,Shubhavi Arya,Shubhavi Arya,,
The Forgotten,None,120,Mystery,,2021,Mirza Ali,"Vishwa Gulati, Nishant Khanduja, Sumit Kriplani, Ajay Mann",,
Roulette,None,,"Short, Thriller",,2020,Soumya Chakraborty,"Rahul Banerjee, Indranil Dey, Debipriya Sarkar",,
Shaheber Chithi,None,22,Drama,,2022,,"Pratik Sen, Debchandrima Singha Roy, Indranil Mallick, Mallika Banerjee",,
What Is Anxiety?,None,21,"Short, Drama",,2020,Shivankar Arora,"Saurabh Raj Jain, Ankita Mithal",,
Rummy Passion Ad: Bonus on first deposit,None,,Short,,2022,"Lakhbir Lovy, 
Dinesh Sudarshan Soi",Jeetu Shukla,,
Dadagiri,None,,Drama,,2007,Joe Simon,"Avinash, B.C. Patil, Shobharaj",,
Sri Ramachandra Kripalu Bhajman (Govind Krsna Das),None,,"Short, Music",,2021,Govind Krsna Das,"Govind Krsna Das, Vikram Sharma",,
Vijay,None,150,"Action, Drama",8.6,1989,Gopal B.,"Nagarjuna Akkineni, Vijayshanti, Kongara Jaggaiah, Jayasudha",,84
Vezhambal,None,,None,4.8,1977,Stanley Jose,"P.K. Abraham, Bahadur, Paravoor Bharathan, Manavalan Joseph",,11
Kaatil Kaun,None,,Mystery,,1959,,"Jabeen Jalil, Chandrashekhar Vaidya",,
Street Light,None,,Drama,,2011,Animesh Roy,"Arjun Chakraborty, Locket Chatterjee, Sreelekha Mitra",,
Chinna Kannamma,Not Rated,130,None,7.0,1993,R. Raghu,"Karthik, Gautami, Suhasini, Shamili",,28
Kunami,None,32,"Documentary, Short",,2016,,Govinda Marndi,,
Amar Sanghee,None,128,Drama,,1987,Sujit Guha,"Prasenjit Chatterjee, Subhendu Chatterjee, Vijayata Pandit, Vijeta",,
Bod Jaat,None,,"Short, Thriller",9.0,2019,Saurav Bhadra,"Archishman Biswas, Keya Chakraborty, Amit Saha",,10
Review of First Class compartment in the Mumbai Local,None,,Short,,2021,,Ayush Khanvilkar,,
Madhusudhan,None,,None,,1941,Balwant Bhatt,"Maya Banerjee, Kumar, Jeevan Dhar, Ashalata Wabgaonkar",,
Maavoori Ganga,None,,None,,1975,,K.S.R. Das,,
Dharampatni,None,,None,,1926,Jyotish Bannerjee,"Durgadas Bannerjee, Patience Cooper, Kartik Dey",,
Periya Veettu Pannakkaran,None,,Drama,,1990,,N.K. Viswanathan,,
Blood on My Hands,None,,"Documentary, Short",,2006,,Anandana Kapur,,
Rhythm & Rox,None,,Music,,2017,,,,
Dak Babu,None,124,"Drama, Family",,1954,Lekhraj Bhakri,"Talat Mahmood, Nadira, Kuldip Kaur, Yashodra Katju",,
Banyan Deer,None,,"Animation, Short",,1959,"Ahmed Lateef, 
G.H. Saraiya, 
Shanti S. Varma",Zul Vellani,,
The Mother,None,108,Documentary,,2017,,Saumya Sharma,,
Band Bottale,None,,"Short, Musical",,2007,,,,
The Last Good Trip,None,,Thriller,,,,,,
Meera,None,120,None,8.2,1947,Ellis Dungan,M.S. Subbalakshmi,,16
Cycling Rhapsodies: Enchanting Woods,None,,"Animation, Short",,2014,,Arun Sripadam,,
Sunburn in Gurgaon: Manish Sharma,None,,Short,,2019,,Manish Sharma,,
Dilwar,None,167,Drama,,2019,Sunil Manjhi,"Nidhi Jha, Arvind Akela Kallu, Sanjay Pandey, Manoj Tiger",,
Das Da,None,,Comedy,,,,Jisshu Sengupta,,
Tuzi Mazi Yari,None,,Drama,,,,"Shreyas Talpade, Rushikesh Zagade, Suchitra Gosavi, Harshada Mane",,
An Anonymous Letter,None,,"Short, Drama",,2017,"Shashwat Dwivedi, 
Shivam Shankar","Sreerag Kr, Utkarsh Raman, Shamangi Sharma, Rishi Solanki",,
Sharada,None,,None,,1951,,Dinkar D. Patil,,
Rose Marine,None,,"Short, Fantasy",,2009,"In Hyung Hwang, 
Young Man Kang, 
Ajay Kumar","Ron Becks, Tim Colceri, Danny Del Toro, Gary Lockwood",,
Pyar Ki Baten,None,,Romance,5.8,1951,Akhtar Hussein,"Nargis, Trilok Kapoor, Neelam, Pran Sikand",,15
Sipah Salar,None,,None,,1936,Jagatrai Pesumal Advani,Khurshid Begum,,
Kuheli,None,20,Horror,,2008,,"Ritwick Chakraborty, Debolina Dutta",,
Kannavari Illu,None,,None,,1978,Kolli Pratyagatma,Anjali Devi,,
Love Will Not Be Tolerated!,None,,"Short, Comedy, Drama",,,,Robert Eugen Popa,,
Sagavaasam,None,,Drama,,2018,S. Thomas Newton,"Jayashree, Mahanadhi Shankar, Powerstar Srinivasan",,
Fomo,None,21,"Short, Family",,,,Shashank Udapurkar,,
Colors,None,96,"Adventure, Drama, Family",,2017,Roopa Iyer,Avrora Mukhina,,
Lakme School of Style,None,,Short,2.1,2015,Akshay C. Pathare,Karan Johar,,9
Priya Milon,None,86,Romance,,2011,Rajesh Bhuyan,"Utpal Das, Avishka Kashyap, Biju Phukan",,
Hathili Dulhan,None,,None,,1932,J.J. Madan,"Abbas, Khurshid Begum, Mukhtar Begum, Patience Cooper",,
Advika,None,,"Short, Horror",,2015,Harsha Annavarapu,Raghunadh Janga,,
Tholi Sariga,None,,None,,2011,Mahesh,"Manoj Nandam, Manoj Nandan",,
Yaar Varga,None,,"Short, Musical",,2017,Sumit Bhardwaj,"Jaswinder Daghamia, The Dark MC",,
Hunar Sidhu: Hadd Tod Da,None,4,Music,,2021,,"Gungun Bakshi, Rittu Jhass, Hunar Sidhu",,
Outsider,None,,Documentary,,,,"Siddesh Shetty, Kanishka Sonthalia",,
Pune tc,None,115,Comedy,,2012,Abhijeet Choudhary,"Sulagna Chatterjee, Abhijeet Choudary, Dhanashree Heblikar, Ayub Khan",,
Lifelight,None,122,Drama,,,,"Murali Gopy, Bhavana, Indrajith",,
Gangnauli: Life in Chocked Desolation,None,21,"Documentary, Short",,2016,,Areeb Hashmi,,
Dhakti Mehuni,None,,None,,1978,Datta Dharmadhikari,"Lekha Chauhan, Avinash Masurekar, Shrikant Moghe, Sharad Talwalkar",,
Parinde,None,,None,,1945,Pralhad Keshav Atre,"Surendra, Vanamala",,
Kanmani Raja,Not Rated,141,Drama,,1974,,P. Madhavan,,
Love at Library Final Part,None,4,"Short, Drama",,2017,Lovesh Nagar,"Siddhant Kapoor, Dolly Kaushik, Nishant Sharma, Sameer",,
Mogra,None,,"Short, Drama",,2020,Mayur Dhamapurkar,"Vikas Chavan, Pankaj Dodkulkar, Hemant Hajare, Deepali Malkar",,
Sakhaldand,None,,"Short, Drama",,2022,Suraj Dalvi,"Rekha Dahatonde, Pawan Kale",,
The Birdman: Pride of Chennai,None,3,Short,9.2,2015,,AmarRamesh,,13
Welcome To Telangana: Official Tourism,None,,"Documentary, Short",,2015,,Dulam Satyanarayana,,
The Origami Dream,None,1,"Short, Fantasy",,2014,,Priyadarshini Indalkar,,
Akasmat,None,,Drama,,2017,,"Shubhrajyoti Barat, Ashvini Bhave, Ipshita Chakraborty, Sameer Siddiqui",,
Chhod Do Aanchal,None,,"Short, Musical",,2002,,"Himani, Ravi Kishan",,
Nanhi pari,None,,"Short, Family",,2019,Amit k Pal,Agni Chaudhary,,
Swathi Chinuku Sandhya Velalo,None,113,Drama,,2022,Ravi Shankar Dishu,"Rekha Boj, Rakesh Earne, Mahesh Kathi, Poornanand",,
Highway Item,None,,"Short, Drama",,2018,,Madhavi Latha,,
Mothron Ki Basti Mein Karna Kunti Samvaad,None,,Drama,,1993,,,,
Beru,None,104,Drama,8.7,2005,P. Sheshadri,"Lakshmi Chandrashekar, H.G. Dattatreya, Neethu, Suchendra Prasad",,21
Mugguru Mithrulu,None,,None,,1985,Rajachandra,"Sobhan Babu, Suhasini, Murali Mohan",,
The Black Day: The day of shame,None,,"Short, Crime, Drama",,2017,Neron Singh,"Minoshka Dsouza, Karan Koikar, Kedar Nerikar, Dilshad Raza Qureshi",,
Oorantha Goolanta,None,,Comedy,,1989,Manishankar,"Brahmanandam, S. Sudhakara Raju, Sridevika",,
The Gang,None,,"Musical, Action, Thriller",2.7,2000,J. Williams,"Vani Viswanath, Baburaj, N.L. Balakrishnan, Sphadikam George",,9
Sesh Sanghat,None,,Action,,2009,Ashoke Viswanathan,"Chiranjit, Bunty Goswami, Rimjhim Mitra, Jaya Prada",,
Maa Ooru,None,,Documentary,,1987,,B. Narsing Rao,,
Shoroter Otithi(Autumn's Guest),None,40,"Documentary, Short",,2020,Sayan Basu Chowdhury,"Misty Das, Ananya Guha, Ananda Choudhuri, Sujata Ghosh",,
Gujarat No Lal,None,144,Drama,,2004,,,,
FILA SS18,None,,Short,,2018,,Ruark Noronha,,
Krishnatulasi,None,134,"Comedy, Drama, Romance",7.6,2018,Sukhesh Nayak,"Ramesh Bhat, Meghashree, Tabla Nani, Kuri Prathap",,33
Sandhya Raag,None,159,None,7.1,1977,Bhabendra Nath Saikia,"Ajit Baishya, Karuna Bannerjee, Hemen Barman, Shakuntala Barua",,11
Maratha Nadu,Not Rated,118,"Crime, Drama, Romance",,2004,Haridas,"Murali, Sudip Joshy, Nithya Das, Urmila Unni",,
Kerala Paradiso,None,77,"Drama, Family",8.6,2016,Bijoy Lona,"Kalesh Ramanand, Murali Mohan, Sree Padma, Siva Sudheesh. N",,5
Ode To Cinema: Thanks for Absorbing the Exiled Existence,None,16,"Short, Drama",,2017,,Amaninder Singh,,
ZEE ASPIRE,None,,Music,,2010,,Omi Vaidya,,
Maa Na Aansu,None,,Drama,,1984,,"Rita Bhaduri, Arvind Joshi, Arvind Kumar, Asha Parekh",,
Justice Viswanathan,None,145,Drama,,1971,G.R. Nathan,"Manimala, R.S. Manohar, Aachi Manorama, Venniradai Moorthy",,
Sardaar & Tuktuk,None,,Short,,2019,Rahul Srivastva,"Kinzza Advani, Vaibhav Mathur, Bramhaswaroop Mishra, Vivaan Shah",,
Graveyard and the Madman,None,11,"Short, Thriller",9.8,2021,Dinesh Kumar Chauhan,"Dinesh Kumar Chauhan, Kulpreet Yadav",,6
Kode Thrachu,None,,Drama,,1984,A. Kodandarami Reddy,"Sobhan Babu, Sridevi, Raogopalrao, Giri Babu",,
Pyar Paap Nahin,None,,Romance,,1988,,,,
Maanas,None,52,Drama,,2011,Dave Jigar,"Aditya Patel, Karm Vyas",,
Conceive,None,8,"Short, Drama",,2018,,Randeep Dua,,
Thili Neeru,None,,Horror,,2016,Yogaraj,"Anusha, Lakshmiraj Shetty, Swathi, Yogaraj",,
Nadaniyaan,None,,Drama,,2019,Deep Dudani,Riyansh Taneja,,
Prateek Group,None,,Family,,2013,Afzal Ahmad Khan,"Shakti Anand, Ragesh Asthana",,
Aakchhoo,None,,Short,,2017,Shoneel Yallattikar,"Sunil Godse, Rutuja Nagwekar",,
Geeta,None,163,None,,1940,Parshwanath Yeshwant Altekar,"Chandra Mohan, Durga Khote, Anant Marathe, S. Prahlad",,
Journeying with Mahasweta Devi,None,51,Documentary,,2009,Joshy Joseph,Mahasweta Devi,,
Bhaag Gangster,None,7,"Short, Crime",,2021,Sanjay Kumaar,"Aftaab, Saurabh Mishra, Renu Verma",,
Dil Kabaddi,None,,None,,2011,Srinivas Balasundaram,"Mohit Chauhan, Uday Kiran",,
Aru Kunu Nari Gandhari Nohoba (No more Women should play the role of another 'Gandhari'),None,,"Short, Musical",,2018,Arindam Barooah,"Kamalakshi Bhuyan, Anjjan Dhan Bordoloi, Rimjhim Chutia, Swapnali Chutia",,
Love Lafru Lagan,None,140,Drama,,2017,Himanshu Patel,"Charuben Patel, Shivani Purohit, Jeet Upendra",,
60 ML,None,22,"Short, Thriller",,2014,Madhubanti Mukherjee,"Joyraj Bhattacharya, Samrat Bhattacharya, Kanad Bose, Anindya Chatterjee",,
Kadhai Paneer,None,,"Short, Drama",,2017,Rahul Rai Gupta,Srin Chakraborty Bhattacharjee,,
Thozhar Pandiyan,None,,Musical,5.7,1994,Manivannan,"Manivannan, Manobala, Napolean, Ranjitha",,11
Munna,None,,Drama,,2021,Sangai Kumaresan,"Kennedy, Niyah Krishna, Sangai Kumaresan",,
Smile Please... It's your tale,None,,"Short, Drama",,2016,,Rahul Suryavanshi,,
Sati Savitri,None,,None,,1957,,Kadaru Nagabhushanam,,
Traverse for hope,None,,"Short, Sci-Fi",8.6,2018,Gaurav Thakur,Purva Thakur,,7
Ira.,None,,"Short, Crime",,2017,Vishnu Bharathan,"Vishnu Premkumar, Abu Valayamkulam",,
Kuzhanthai,None,,"Short, Drama, Family",,2018,Hussain Rizwan,"Rafiuddin, Vivek Raju, Shri Shri, Laxmi Sunil",,
Mishiha Charithram,None,,None,,1978,,"A. Bhimsingh, R. Thirumala",,
Kolkata Fashion Week 2014,None,,None,,2014,Anju Modi,Dimpy Ghosh,,
Lajja -The Shame,None,160,Drama,7.0,2010,Dayal Acharya,"Haradhan Bannerjee, Raja Chatterjee, Dipankar Dey, Rajatabha Dutta",,7
Kalpavigyan: A Speculative Journey,None,82,Documentary,,2021,,Arunava Gangopadhyay,,
Bandipotu,None,155,Drama,7.8,1963,B. Vittalacharya,"N.T. Rama Rao, T. Kirshna Kumari, Mikkilineni",,22
Kalpvriksha,None,15,"Short, Drama, Family",8.3,2016,Abhijeet Khuman,"Tom Alter, Kritika Pande, Chandani Sharma",,6
Crab Catchers,None,14,"Documentary, Short",,2016,,Prem Hessenkamp,,
Hridhayam Paadunnu,None,,None,,1980,G. Premkumar,"Jalaja, Jayamalini, Jose, Ravi Kumar",,
The Touch,None,48,None,,2017,,Anand Vrs Tomar,,
Goa Trip May'13,None,,Short,,2013,,"Ashish Hanc, Naveen Johnson, Mahen Kumar",,
Mahiya: Call of Love,None,,Romance,,2005,Rajkumar R. Pandey,"Laxmikant Berde, Gaurav Ghai, Shakti Kapoor, Bobby Khan",,
Khalnayika,None,136,Thriller,,2017,Hemant Nilim Das,"Utkarsh Kanchan, Sonia Kohli, Fairy Priya Ahmed, Alok Bhardwaj",,
Shekhchilli Aur Sherkhan,None,32,"Short, Comedy",,2019,Dhruv Tyagi,"Rahul Kumar, Moni Sharma, Shekhchilli Hariram Toofan",,
Naanum Indha Ooruthan,None,,Drama,,1990,,Shegar Raja,,
The White Fields,None,21,"Short, Drama",,2017,Kartik Parmar,"Murari Kumar, Krishna Shukla, Suhani, Ankit Kashyap",,
Hayratt,None,,Thriller,,1992,Kirti Rawal,"Rakesh Bedi, Anil Dhawan, Sonika Gill, Iftekhar",,
Sahira,None,,Short,9.6,2016,Utpal Kalal,"Faiza Khan, Mayur Pariyani",,64
Hawai Sawar,None,,Action,,1929,Mohan Dayaram Bhavnani,"Dinshaw Bilimoria, Baburao Chinchgar, Diana, Jillo",,
Makkana,None,115,Drama,,2019,Raheem Khadar,"Indrans, Santhosh Keezhattoor, Kulappulli Leela, Sajitha Madathil",,
Stacked,None,,"Short, Music",,2021,,R.S. Arun Prakaash,,
Bull Kumar,None,,Biography,,,,,,
Gehna,None,,"Short, Crime",,2016,Nayan Pachori,"Ajay Gupta, Poonam Sharma, Abhishek Tiwari",,
Dhundh,None,9,"Short, Drama",,2018,Abhishek Dhandharia,"Sandeep Jain, Debabrat Samal",,
Marutrisha,Not Rated,130,Drama,,1964,Suresh Ray,"Asit Baran, Savitri Chatterjee, Bipin Gupta, Nabadwip Halder",,
Drama Queens,None,52,Documentary,,2019,Sohini Dasgupta,"Moloyashree Hashmi, Sabitri Heisnam, B. Jayashree",,
Escape,None,,"Drama, Thriller",,2018,Darshan Gowda,"Deepam Kohli, Sheetal Shetty, Raghu Pandeshwar, Sudarshan",,
Blacky,None,20,Short,,2018,Nilesh Khandale,Meenakshi Rathod,,
11 Weeks,None,30,"Short, Drama",7.8,2010,Dipesh Jain,"Dion Deboulle, Danish Iqbal, M.K. Raina",,10
Aleppo Autumn,None,,"Short, Drama",,2017,Aditya Khati,Saurav Banerjee,,
Swacha Bharat the Gifts,None,,Short,,2017,Vinamra Pancharia,"Kaivalya Chheda, Vinamra Pancharia",,
Moodila muchata,None,132,Drama,,1985,Kodi Ramakrishna,"Chandramohan, Jayamalini, Aruna Mucherla, Gollapudi Maruthi Rao",,
Hungry Dogs,None,4,Short,,2018,Karan Darra,"Rajesh Pal, Manmeet Singh Sawhney",,
A Tune of Devotion,None,11,"Documentary, Short, Drama",,2018,,Varun Chounal,,
Warning,None,125,Drama,,1996,K.S. Nageswara Rao,"Aamani, Jaya Prada",,
