Movie Names,Certificate,Duration,Genre,Rating,Years,Director,Actors,Gross,Votes
B3I (Bicky's three incidents),None,,Fantasy,,,Rupayan Dey,"Abhishek Saha, Suman Sarkar, Soumya Brata Mukherjee, Saheli Saha",,
The Rainy Day,None,5,Short,8.5,2020,Avirup Biswas,Avirup Biswas,,11
Zakhmi Wagin,None,,Action,,1984,Vasant Painter,"Roohi Berde, Kamini Bhatia, Jayshree Gadkar, Ravindra Mahajani",,
Rhythmatics,None,16,"Short, Drama",,2010,,Hitesh Kewalya,,
Chhalava,None,,Thriller,,,,,,
Azad Veer,None,,None,,1931,,Dhirubhai Desai,,
Devi Devayani,None,150,None,,1931,Chandulal Shah,"Gohar Jan, Kamlabai Gokhale, Dinshaw Bilimoria, M. Bhagwandas",,
Night Club,None,137,"Crime, Drama",6.2,1958,Naresh Saigal,"Ashok Kumar, Kamini Kaushal, Mubarak Mechant, Nishi Kohli",,9
Vivahit Jeewan,None,,Drama,,1991,,"Babloo, Harish, Sadhana",,
Chappalled,None,18,Short,8.9,2014,Yusuf Abidin,"Usman Abu Baker, Mohammad Mustehsan, Mohammad Tayyab",,7
Janmapatri,None,,None,,1949,,"Ajit Khan, Madhubala, Pran Sikand",,
Milan,None,,Drama,,1942,Jyotish Bannerjee,"Ratin Banerjee, Biman Bannerjee, Dhiraj Bhattacharya, Chhabi Biswas",,
Vikasikkunna Chirakukal,None,,Short,,1989,,P. Bhaskaran,,
Life of a Sugarmill,None,,"Documentary, Short",,2022,Vijay Sharma,Vijay Sharma,,
Beena,Not Rated,105,None,,1978,N. Narayanan,"Jayabharati, Jose, Alummoodan, Khadeeja",,
The few unfortunates,None,4,Short,,2011,Sushant Kapdoskar,"Mayur Borhade, Saket Patil",,
28 Super Non Stop Punjabi Remix,None,,"Short, Musical",,1999,,"Manoj Pahwa, Sudhanshu Pandey",,
The Winning Post,None,24,Sport,,2008,,"Mohit Lalvani, Mandira Lalvani, Carina Chavda",,
A Girl Child,None,101,Drama,,2018,P. Sheshadri,"Baby Revathi, Siri, Meera, Sarvagna Acharya",,
Funny Nights with Kohli,None,12,Comedy,,2020,,"Dhruv Dalal, Dilpreet Kohli, Rashmeet Kaur Sethi",,
Kissmisses,None,,"Short, Drama",,2012,Srikanth Kandragula,Teddy joy Sweety,,
Gaash: Light,None,14,"Short, Drama",8.8,2019,Danish Renzu,"Neelofar Hamid, Muazzam Bhat, Farhana Bhat, Shahid Lateef",,10
Vasant Bala,None,,None,,1926,Nanubhai B. Desai,"Miss Jones, Master Vithal",,
Qaumi Ekta Week 2018,None,53,News,,2018,Rajkumar Garewal,"Shiva Ji Aryan, Simrat Chahal",,
Disco Bhonti,None,,"Short, Musical",,2016,Mridul Gogoi,"Priyanka Baishya, Rakesh Boruah, Kussum Koilash",,
Barish Ke Mausam Me,None,,"Short, Music",,2020,,Vivek Thakuri,,
Malinteso,None,5,"Short, Comedy",7.4,2016,Anand Krishnan,"Anand Krishnan, Yajus Kishor, Aravind Sivan, Varun R.",,7
Ramudu Manchi Baludu,None,,Comedy,,2007,Praneet,"Brahmanandam, Rangababu",,
Avan Aval,None,153,Drama,,2016,Ramesh Krish,"Devika Madhavan, Vignesh",,
Boomerang,None,2,Short,,2012,Ashik Kumar Satheesh,Avinav S. Menon,,
Sare Tujhyach Sathi,None,,Drama,,2018,,,,
Policekaran Magal,None,,"Drama, Romance",7.0,1962,,C.V. Sridhar,,7
Mohabbatein,None,20,Drama,,2008,,"Anuj Saxena, Iris Maity, Manish Goel, Shakti Anand",,
Aankh Ki Sharm,None,,None,,1943,Balwant Bhatt,"Prithviraj Kapoor, Trilok Kapoor, Kaushalya",,
Sindhoora,None,,None,,1992,,Uma Maheswara Rao,,
Mayavi,None,23,"Short, Thriller",,2018,Madhur Bakhle,"Dhanashri Bhalekar, Milind Joshi, Pooja Krishna, Dhananjay Patil",,
Cheesh,None,5,"Short, Comedy, Thriller",,2018,Jayesh Jaidka,"Jayesh Jaidka, Saif Khan",,
Red,None,,Documentary,,2007,Anamika Bandopadhyay,Katy Mikelle,,
Palaivanathil Pattampoochi,None,,None,,1988,,Durai,,
Chiraag,None,22,"Documentary, Short",,2009,,Smita Kudva,,
Metronome,None,,"Short, Drama",,2018,Akash Singh,Akash Singh,,
A Tiny Thing Brings Death,None,,Documentary,,1949,,"Fali Bilimoria, Paul Zils",,
Back Pocket,None,,Romance,,2003,Sreedhar Beecharaju,"Vijaya Sai, Sonyraj, Ananth, Harinath Babu B.",,
Prem Pariksha (II),None,,None,,1928,G.K. Mehta,Kumar Vijay,,
Novembernalli Naanu Avalu,None,,Romance,,2019,Nagashekar,Vikram Ravichandran,,
Love in Bombay,None,,Romance,,2001,,"Indrani Banerjee, Sultan Djorghi, Rina Frank T., Narendra Jha",,
After the Silence,None,,"Documentary, Short",,1977,,S. Sukhdev,,
Rajagopuram,None,,Drama,,1985,Pandiyan,Nalini,,
Kanikanum Neram,None,,None,,1987,Rajasenan,"Aranmulla Ponnamma, Jose Prakash, Ratheesh, Sadiq",,
Chanda,None,27,"Short, Horror",,2017,Faizal Khan,"Gagan Pradeep, Roshni Sahota, Kuldeep Singh, Rajshree Verma",,
Kalitharu Henne,None,,None,8.8,1963,N.C. Rajan,"Leelavathi, Rajkumar, Advani Lakshmi Devi, R. Nagendra Rao",,10
Sanjay on Call,None,,Mystery,,2022,Jayan Naduvathazhath,Besu M George,,
Aloy Phera,Not Rated,142,Drama,,1985,Ajit Ganguly,"Dipankar Dey, Mahua Roy Chowdhury, Anil Chatterjee, Rabi Ghosh",,
Chakrabuho,None,,Short,8.0,2017,Subho Das,"Ahiri Biswas, Anindya Ghosh, Subho Das, Gourab Mitra",,11
Bilwa Mangal,None,,Romance,,1919,Rustomji Dotiwala,"Gohar Jan, Dorabji Mewawala",,
The Chair,None,,"Short, Thriller",,2016,,Parth Shukla,,
Chhade Malang,None,,Romance,,1981,Surendra Sinha,"Shakti Kapoor, Rama Vij",,
Afternoon with Julia,None,,"Short, Drama",,2016,Abhiroop Basu,"Samadarshi Dutta, Neha Panda",,
Baba,None,,Documentary,,1965,,Harisadhan Dasgupta,,
Fitness Diva Basmati Rice TVC ft. Maheck Chahahl,None,,Short,,2018,Shubh Karman,Mahek Chahal,,
Before You Go-Love,None,52,"Drama, Romance",,2020,"Tarun Rastogi, 
Shashank Shekhar Singh","Neeta Iyer, Vibhu Kaushik, Piyush Kumar",,
An Unknown Attraction,None,6,"Short, Drama",,2009,Saifiz Ahamed,"Roup Adhikari, Krishanaur Karmakar, Mahammad Mesbauddin, Jamini Purohit",,
Soldier Saints,None,31,"Documentary, Short",,2017,,Malika Guram,,
Shakuntala,None,,Drama,,,,Isheeta Ganguly,,
Lady Commissioner,None,143,Drama,,1997,Naganna,"C. Arunpandian, Ashalatha, Bhagyashree, Sadashiv Brahmavar",,
Galti Kiski,None,,"Short, Drama",,2019,Ansh Dixit,"Asif Khan, Sarika Tripathi, Vinay Sharma",,
Hide N' Seek,None,,None,,2012,Anil,"Jayan Cherthala, Divyadarshan, Natasha Doshi, Maha Gaida",,
Kathanayika Molla,Not Rated,144,"Drama, History, Musical",,1970,Padmanabham,"Vanisri, Haranath, Padmanabham, Tyagaraaju",,
Full Tight Pyathe,None,119,Drama,,2019,Slg Puttanna,"Beeradra, Manasa Gowda, Mm Murugaraj, Slg Puttanna",,
Zindagi,None,,Drama,,1942,Amiya Chakrabarty,"Master Bhagwan, Nalini Jaywant, Ashok Kumar",,
The Secret Life of Objects,None,24,"Short, Thriller",,2009,Madhur Verma,"Keshav Bhatia, Poppy Burman, Aratrika Guha, Sanchita Mukherji",,
Closed Windows,None,,Drama,,1997,Prema Karanth,"Rati Agnihotri, Tushar Dalvi, Gulshan Grover, Atul Kulkarni",,
Chaos,None,,Animation,5.3,1967,,Ram Mohan,,13
Uttar Katha,None,,Drama,,2009,,"Alok Chatterjee, Shobha Chatterjee, Bisna Chowhan, Alka Mogha",,
Guilt,None,,"Short, Drama",,2018,"Dhruvv Pankaj Kachhawa, 
Kevin Martin","Zeeshan Ansari, Ishaan Deo, Ishita Karnik, Tanvi Kondhalkar",,
Khaki Chokka,None,,Drama,,2001,Vicky,"Sai Kumar, Neelambari",,
Soundarya Pooja,None,,None,,1973,B.K. Pottakkad,"Bahadur, Adoor Bhasi, Rani Chandra, Jayabharati",,
Laiye Tod Nibhaiye,None,,Drama,,1966,Satish Chabbra,"Ved Anand, Satish Chabbra, Ravindra Kapoor, Nishi Kohli",,
Dil Le Gail Sawarki,None,,"Short, Music",,2018,Ashish Tiwari,Kishan Rai,,
Kanya Vikraya,None,,None,,1924,V.S. Nirantar,"Krishnarao Chauhan, Bhaurao Datar",,
Bela,None,,None,,1947,Chaturbhuj Doshi,Nigar Sultana,,
56608,None,,"Documentary, Short",,2013,,Sudhi Narayan,,
Sharabi Ki Ladki,None,,Drama,,1960,,,,
Pandagala Vachadu,None,,None,,,Karthikeya Prasad,"Nara Rohith, Neelam Upadhyaya",,
Swarna Palace,None,,Drama,,2021,,"Ankitha, Anusha, Mounika",,
JaiMala: True love doesn't have happy ending.,None,20,"Short, Drama",,2021,Ganesh Vulidra,"Sukriti Gupta, Janesh Sharma, Raj Kumar Arya, Manasi Mishra",,
Naya Daur,None,9,"Documentary, Short",,1975,,S.N.S. Sastry,,
Chinna Patra,None,130,Drama,7.9,1972,"Tarun Majumdar, 
Dilip Mukherjee, 
Sachin Mukherjee, 
Yatrik","Uttam Kumar, Supriya Choudhury, Madhavi Mukherjee, Asitbaran",,12
Koshish-It's a Beautiful Day,None,,Short,,2015,Devanand Mahakud,"Suraj Avinash, Raakhee Bose, Indumathi Manohar",,
46th Filmfare Awards,None,,Reality-TV,,2001,,"Hrithik Roshan, Karisma Kapoor, Tara Deshpande",,
Pachar: Palter,None,92,Crime,8.5,2015,Prajna Dutta,"Nigel Akkara, Saurav Banerjee, Santilal Mukherjee, Suman Saha",,7
All that glitters and swims,None,,"Short, Crime",,1996,,Sunny Menon,,
Ezhuthatha Katha,None,153,None,6.5,1970,A.B. Raj,"T.K. Balachandran, Paravoor Bharathan, Adoor Bhasi, Nellikode Bhaskaran",,8
Illusoin,None,,"Short, Crime",,2016,Ramesh Mishra,"Vidushi Kadam, Dilip Pandey, Ravi Sharma",,
Chintamani,None,,Drama,,1933,Sadasiva Rao Kallakoori,"Venkateswarlu Pulipati, Ramatilakam",,
Kanavu,None,7,"Documentary, Short",,2021,Nebish Benson,"Bellan, Leela Santhosh",,
Sane Guruji,None,,Biography,,2005,Sandeep Kashyap,"Sadashiv Amrapurkar, Suhas Bhalekar, Anil Gawas, Vikram Gokhale",,
Porter Kunjali,None,,None,,1965,"Sasikumar, 
P.A. Thomas","Bahadur, Adoor Bhasi, T.S. Muthaiah, Prem Nazir",,
The Stinking Heart,None,6,"Short, Drama",,2017,"Ravneet Kaur, 
Ravneet Kaur",Ravneet Kaur,,
Bhoy,Not Rated,158,Thriller,7.2,1996,Chiranjit,"Subrata Banerjee, Satya Bannerjee, Soumitra Bannerjee, Mahashweta Bhattacharya",,8
Gul Badan,None,,None,,1937,Kanjibhai Rathod,Ansuya,,
Tomorrow Shall Be Better,None,,"Documentary, Short",,1965,,Khwaja Ahmad Abbas,,
Gangaputra,None,,Action,,2023,Megastar Maharishi Aazaad,Megastar Maharishi Aazaad,,
Sales Lesson from wolf in Hindi by Avijit Ghosh,None,,Short,,2022,Avijit Ghosh,Avijit Ghosh,,
Paramu,None,,Drama,,2019,Manick Jai,Manick Jai,,
Kudumba Thalaivan,Not Rated,138,None,6.9,1962,M.A. Thirumugham,"Saroja Devi B., M.G. Ramachandran, S.A. Ashokan, M.R. Radha",,11
Who Is She?,None,12,Short,,2018,Raj Acharya,"Naveen Bawa, Spandan Chaturvedi, Pratichee Mohapatra, Zoe Petra",,
Paun Baran,None,,Drama,,1969,,"Ravindra Kapoor, Khairati, Nandini, Gopal Sehgal",,
Teen Kahini,None,,Thriller,,2021,Suvendu Das,"Arnab Das, Sterela Goswami, Akash Kirtania, Arman Singh",,
Goolihatti,None,156,Drama,,2015,Shashank Raj,"Sudha Belawadi, Swayamwara Chandru, M.N. Lakshmi Devi, Doddanna",,
Mom - An Everlasting Bond,None,,"Short, Family",,2020,Lakshmi Sunil,Aniruddh Roy,,
Mel Maruvathoor Arpudhangal,None,,Family,,1986,S. Jagadeesan,"Jai Ganesh, Aachi Manorama, K.R. Vijaya",,
Jai Madhya Pradesh,None,,"Short, Musical",,2018,,Rishikesh Pandey,,
Aayi Re Holi,None,,"Short, Music",,2020,Vijay Nayyar,Nikhil Chaudhary,,
Kathah Vichitrah,None,,"Horror, Mystery",8.3,2017,Anup Antony,"Harry Correa, Sri Harshavardhan, Anu Poovamma",,6
Perfectly Imperefect,None,15,"Short, Romance",,2017,Shivam Tiwari,"Vinamra Pancharia, Krutika Desai, Ishwar Tiwari",,
Parshuram,None,,None,,,Raj Kishore Prasad,"Yash Kumarr, Harshita Kashyap",,
Superstar,None,137,Comedy,5.2,2011,Mahendra Kadam,"Priya Arun Berde, Rohit Chavan, Kishore Chougule, Yogini Chouk",,14
VIVO Film,None,,Short,,2020,,Srimanta Senguptta,,
The Phantom Realm,None,,Animation,,2021,,Devansh Mathur,,
ala motha shana,None,,"Short, Music",,2019,,,,
Belt Mathai,None,,"Action, Drama",,1983,T.S. Mohan,"Sukumaran, Ratheesh, Lalu Alex, Unni Mary",,
Arasiyalla Ithellam Sagajampa,None,,Drama,,,Sakthi Ajay Kumar,"John Vijay, Manobala, Powerstar Srinivasan",,
Twist eat,None,10,Family,,2017,,"Suyash Tilak, Chef Pradip Bhawalkar",,
Indira B.A.,None,,Drama,,1929,R.S. Choudhury,"Khansaheb, Ruby Mayer",,
Mud Mud Ke Na Dekh,None,11,"Short, Thriller",,2016,Nikhil Allug,"Sulagna Panigrahi, Mayukh Ray, Sharda Nand Singh",,
Miss Pooja Feat. Millind Gaba: Sohnea 2,None,4,Music,,2019,Raw Eye,"Millind Gaba, Miss Pooja",,
Prem Yogayog,None,,Romance,,2021,Nitin Kamble,"Abhijeet Dulgach, Nitin Kamble, Rajesh Kamble, Shubhangi Latkar",,
The Title of This Poem,None,6,"Short, Drama, Family",,2016,,Yedhu Krishna,,
Pandavapuram,None,93,Fantasy,,1986,G.S. Panicker,"Appu, James, Meena Krishnan, Jameela Malik",,
Cigarette,None,,"Short, Thriller",,2019,VenkataMadhuShankar,"Avinashvarma, Pavan",,
Mani Kanchan,Not Rated,134,Drama,,1992,Ashim Banerjee,"Satya Bandopadhyay, Shakuntala Barua, Nirmal Kumar Chakraborty, Biplab Chatterjee",,
Thirbokigalu,None,,Romance,,2018,Bhusan,"Manya, Anirudha Sastry",,
Hands of A,None,15,"Short, Drama",,2022,Snigdha P. Roy,"Amit Bimrot, Bhavya Sharma, Raaj Sharma, Divisha Chandan Vaid",,
Lagna Bandhan,None,157,"Drama, Family",,1936,Kali Prasad Ghosh,"Sabita Devi, Motilal, Aruna Devi, Leela",,
Opaja Sonor Mati,None,,None,,1972,,Brojen Barua,,
A Wish for Yesterday,None,7,"Short, Drama",,2017,Elvis Furtado,"Nisha Mary Raj, Vivek Jadhav, Ajinkya Khanvilkar, Avishek Kar",,
Eesal,None,9,Short,,2016,Harry J. Heffes,"Chandru, Moorthy, Celina Benita Sebastian, Smith",,
Nehle pe dehla,None,,"Short, Drama",,2017,Rahul Rai Gupta,"Arka Banerjee, Smita Bhowmic, Sangita Mondal",,
At My Doorstep,None,70,Documentary,7.8,2009,,Nishtha Jain,,13
Nenjathai Killadhe,None,,Drama,,2008,Ahathian,"Manivannan, Vikramaditya, Vikranth",,
Njan Piranna Nattil,None,,None,7.1,1985,P. Chandrakumar,"Mohanlal, Aruna Mucherla, Raghavan, Saleema",,16
Insaaf Kithe Ah?,None,,None,,1959,Dharam Kumar,Sushil Kumar,,
Ever Ready,None,,None,,1946,,"Pepo Oliva, Sharda",,
Vadina,None,,None,,1955,M.V. Raman,"B. Ramakrishnaiah Panthulu, Pandari Bai, Addola Narayana Rao, Akkineni Nageshwara Rao",,
Pariksha Pe Charcha 2022,None,,None,,2022,,Narendra Modi,,
Blazing Bajirao,None,16,History,,2015,,"Priyanka Chopra Jonas, Deepika Padukone, Ranveer Singh",,
Dark Night,None,,Thriller,,2001,Mahmood Khan,"Biswajeet Chatterjee, Ramesh Goyal, Jay Kalgutkar, Dev Malhotra",,
Piya Bavari Again: Payaliya,None,,"Short, Romance",,2005,,"Aditya Bal, Sheetal Menon",,
Shri Satyanarayan,None,,None,,1935,,Leela Chitnis,,
Ek Naya Bhor,None,30,"Short, Drama",,2011,Ashok Mehta,"Danish, Arpita Ghosal, Kanishka Mahapatra, Dia Mirza",,
Jalaamsham,None,,None,,2018,M.P. Sukumaran Nair,"Jagadish, Manju Pillai",,
When It Gets Dark,None,5,"Short, Horror, Thriller",,2015,Ranbir Singh,"Harman Punn, Raghav, Ranbir Singh",,
Nyayaniki Siksha,None,,None,,1988,,Rama Rao Tatineni,,
Sthanantaran,None,,"Short, Thriller",,2020,Harsh Chaudhari,"Vaishali Adwani, Jayesh Nahar",,
That's My Choice: Lucknow Girls,None,3,"Short, Drama",,2015,Ratul Soumya Tripathi,"Riya Khare, Jenifar Siddiqui, Tanushri",,
Priyo Charitra,None,,"Short, Drama, Fantasy",,2020,"Swetketu Banerjee, 
Neelotpal Sinharoy","Anwesa Bandyopadhyay, Swetketu Banerjee, Susmita Chatterjee, Subhajit Nag",,
Badnam,None,,Drama,,1952,D.D. Kashyap,"Helen, Murad, Balraj Sahni, Shyama",,
Evaru Monagadu,Not Rated,153,Drama,,1968,T.R. Sundaram,"Kantha Rao, Sowcar Janaki, Ram Mohan, Rajasree",,
Shri Krishna Leela,None,,None,,1920,,Gajanan V. Sane,,
Breakfast in Bangalore the Sitcom,None,230,Comedy,,2018,"Mike Fontana, 
Ashwin Koushan","Adit Dileep, Brinda Dixit, Spurthi Reddy, Maduram Fontana",,
Kizhvanam Sivakkam,Not Rated,138,None,6.2,1981,Muktha V. Srinivasan,"Sarite, Sarat Banu, Shivaji Ganesan, Sarath Babu",,8
Anomaly,None,25,"Short, Thriller",,2015,Shubham Beluse,Amrish Tallu,,
Pendli Pilupu,None,,Drama,,1961,Seshagiri Rao D.,"N.T. Rama Rao, Devika, Seeta Rama Anjaneyulu Chilakalapudi, Girija",,
Sant Raghu,None,,None,,1957,Chandrakant,"Anand Kumar, Lalita Pawar, Nirupa Roy, Tun Tun",,
Satyavijay,None,,None,,1926,Shree Nath Patankar,"K.B. Athavale, K. Narayan Kale, Thatte",,
Solvathellam Unmai,None,,None,,1987,,"Jaishankar, Rekha, Vijayakanth",,
China Meter,None,27,"Short, Crime, Mystery",,,Nischay Rout,"Prateek Parmar, A.R. Rama, Amitriyan Patil, Ghazal Shrivastava",,
Rifles,None,,"Drama, Action",,2002,Dasari Narayana Rao,"Vijayshanti, Arun Kumar Dasari, Prakash Raj, K. Viswanath",,
Laadla Number 1,None,,Romance,,2016,Uttam Mondal,"Santwana Bose, Ramen Roy Chowdhuri, Sangita Das, Baban Saha",,
Tera Naal Preet Laga Li,None,,"Short, Music",,2021,,"Nadeem Ansari, Pravin Singh",,
Baale,None,7,"Short, Music",,2017,Shruthi Sharanyam,"Rima Kallingal, Arushi Mudgal, Haripriya Namboodiri, Nanditha Prabhu",,
Thippaji Circle,None,147,Drama,,2015,Adithya Chikkanna,"Anitha Bhat, Dhruvaa, Pooja Gandhi, Srinivasa Murthy",,
Around the Water Table,None,7,"Short, Comedy",,2018,,Barry E. Stone,,
Rabbit Farming,None,32,"Documentary, Short",,2017,,Venkatramana Hegde,,
Ganga Aur Geeta,None,,Action,,1979,M. Bahl,"Anil Dhawan, Rakesh Roshan, Tanuja Samarth, Asha Singh",,
Mukti Sangram,None,,None,,1931,Jayant Desai,"Madhav Kale, Prabha Shanker, Mumtaz, Ghori",,
Gajanana Re Gajanana,None,2,"Short, Musical",,2021,Yogesh Anil Tawar,Vaibhav Lamture,,
Anaganaga Oka Nanna,None,,"Short, Drama",9.7,2019,Deepthi Ganta,"Seema Chowdary, Venkat Siddareddy, Tnr, Vanshika",,7
Maragatham,None,203,None,6.6,1959,Sriramulu Naidu S.M.,"Padmini, Shivaji Ganesan, Sandhya, Sundaram Balachander",,7
Akasam,None,,Adventure,,,Mandava Sai Kumar,Mandava Sai Kumar,,
Gusse me,None,,"Short, Music",,2017,ishQ Bector,ishQ Bector,,
Madhuman,None,,None,,1981,,Basu Bhattacharya,,
Legal Tender,None,,Short,,2021,Arjun Menon,"Dia Agarwal, Kavyya Iyer, Chirag Krishna, Arjun Menon",,
The Big Talk (Part-I),None,,"Documentary, Short",,2016,,Vivek Rai,,
Shajiyappan,None,30,Short,,2022,Bharathi Kavi,"Reshimi Karthigeyan, Lohita Sree Santhosh, Maanya Madhavan, Shinoj",,
Nichayam,None,,None,,1984,,Sathyaraj,,
Agnimrigam,None,,None,,1971,M. Krishnan Nair,"Prem Nazir, Sathyan, Sheela, Alummoodan",,
Julum,None,,None,,1990,Ravindra Mahajani,"Lata Arun, Datta Chavan, Sudhir Dalvi, Ambadas Danve",,
Biharflood Madad Ek Sahyog,None,,Documentary,,2017,"Devendra Chaudhary, 
Manis Gupta",Ranjan Mistry,,
Rajavukku Etha Rani,None,,None,4.1,1978,,Sridevi,,9
Sagar Jaisi khaari,None,,"Short, Music",,2020,,,,
Sparsh: The Touch,None,,"Comedy, Horror",,2003,Manoj Sharma,"Susheel Jangira, Kunal Kapoor, Shikhar, Pankaj Berry",,
Loki Ajj Kal: Rajveer,None,,"Short, Romance",,2015,Sumit Bhardwaj,Rajveer,,
Ticket to Bombay,None,,Short,,2016,Yohan Fernandes,"Bomie E. Dotiwala, Aayushi Lahiri",,
Nalvaravu,None,,Drama,,1964,,"Rajashree, Ravichandran",,
Sa,None,128,Drama,,2016,Hemanth Hegde,"Ramesh Bhat, Doddanna, Hemanth Hegde, Samyuktha Hornadu",,
Parvathi Kalyanam,None,,None,,1936,,Parshwanath Yeshwant Altekar,,
The Golden Hour,Not Rated,60,"Documentary, Action, Biography",,2013,,"Jessica McGaugh, Roma Sur",,
Umang,None,,"Romance, Thriller",,1989,,,,
Shekhar Mera Naam,None,,Action,,1983,Neelam Mukherjee,"Aparna, Manik Dutt, Madhushala, Joy Mukherjee",,
Keranir Mas Kabar,None,,None,,1931,Jyotish Bannerjee,"Santi Gupta, J.N. Sinha",,
Qismath,None,,"Documentary, Short",,2016,,Samarth Kadkol,,
Two Generations,None,,Family,,2019,Bhanu Pratap Singh,"Aaditya Pratap Singh, Richa Sharma, Purvi Vaishnav, Man ya Sharma",,
Last Cup of Tea,None,11,"Short, Drama",,2018,,Farha Alam,,
Bundelkhand,None,,"Documentary, Short",,2009,,Rajeev Shankar Gohil,,
R.A.N.I,None,,Musical,,,Rick Basu,Akshay Kapoor,,
Aasamaan se Oopar,None,18,"Short, Drama",,2021,Sandeep,"Krishan Bhargav, Neeraj Saidawat, Sandeep, Harshita Sharma",,
Bahu Heba Emiti,None,,Drama,,1988,Vijay Bhaskar,"Debu Bramha, Namrta Das, Anang Dwivedi, Akshaya Mohanty Kashyap",,
Meenakshi,None,22,"Short, Romance, Thriller",,2020,Dipak Shah,"Niharikaa Agarwal, Tauqeer Iqbal, Bhavesh Kantaria",,
Destination Konkan,None,,Documentary,,1956,,Clement Baptista,,
[v] Kidnap,None,,Reality-TV,,2009,,Manish Anand,,
Gadya Aapla Gaon Bara,None,,Drama,,2013,Dharmanand Vernekar,"Mohan Agashe, Makarand Anaspure, Shilpa Anaspure, Babita Angle",,
Opportunity,None,5,Short,,2016,,Jazeer Thekkekara,,
Bang Gang,None,,Music,,2017,Sukh Dhillon,"Jassi Lokha, Amrit Randhawa, Rohanpreet Singh",,
Ashtamudi Kayal,None,,None,,1978,K.P. Pillai,"Adoor Bhasi, Adoor Bhawani, Jayabharati, Meena",,
Basant,None,13,"Documentary, Short",,1997,,Yousuf Saeed,,
Recce,None,100,"Adventure, Comedy, Drama",,,,Siddhesh Danait,,
The Other Room,None,,"Crime, Drama, Thriller",,2020,Prarjun Majumder,"Archna Singh, Armaan Erum, Sagar Sharma",,
Meri Jaan,None,,"Short, Music",,2020,"Lavish, 
Shubham","Javed Hussain, Himanshi Jain",,
Forever & Always,None,,Short,,2016,Nooruddin Sayyed,"Rohan Shah, Pooja Ghai Rawal",,
Bardidi,None,128,Drama,,1939,Amar Mullick,"Jogesh Choudhury, Nirmal Bannerjee, Sailen Choudhury, Bhanu Bannerjee",,
The time cafe,None,,Mystery,,2021,,Simran Khan,,
Ichha,None,,"Short, Drama",3.0,2017,Samadrita Deb,"Kamalika Ghosh, Suchetona Joarder",,17
Madhuramee Yathra,None,122,Drama,,2018,Satheesh Guruvayoor,"Shivaji Guruvayoor, Maanav, Rajani Murali, Krishna Prasad",,
Dhool,None,141,Drama,,2011,Dharani,"Sudha Belawadi, Prakash Raj, Aindrita Ray",,
Link,None,,"Short, Music",,2020,Bhindder Burj Shah,"Davy Gill, Megha Sharma",,
Manaswini,None,,None,,1968,P. Bhaskaran,"P.J. Anthony, Bahadur, C.A. Balan, Adoor Bhasi",,
dreams,None,10,"Short, Drama, Music",,2017,,Athithya Kanagarajan,,
DD News: Asia News,None,,News,,2013,,,,
Aaj Ki Taaqat,None,,None,,1992,Anil Nagrath,"Jaya Mathur, Anil Nagrath, Sunil Puri, Upasna Singh",,
Carnitapu,None,15,Short,,2021,Amaan Ahmad,Krishna Soni,,
Anamika,None,,Thriller,,1995,Swathi Bhaskar,"Anjitha, Rejis Johns, Kochaniyan",,
Stages of Love,None,114,Romance,,2016,,"Prudhvi Chandra, Mounima",,
Expectations vs. Reality,None,,Comedy,,2015,,,,
Nayi Shuruwat,None,,Short,,2015,,Abhinav Kamal,,
Dedh Lakh Ka Suit,None,,Short,,2020,Sumedh Jagtap,"Preet Anand, Dheeraj Mattoo, Suraj Mattoo, Mamta Singh",,
Pawan Singh: Hamaar Wala Dance,None,3,Music,,2019,"Raka, 
Rakesh Thakar Raka","Mohit Chopra, Jannat Zubair Rahmani, Khyati Sharma, Pawan Singh",,
Mr & Miss 7 States,None,,Adventure,,2019,,"Amit Sobti, Sonu Sood, Mugdha Godse, Neaha Raj",,
Searching Happiness,None,25,"Short, Drama",,2016,"Ram Dinesh, 
Ram Dinesh Sharan","Bhagwan Das, Gurman, Manka Kaur, Gunjan Sinha",,
Love You Zindagi,None,,Romance,,,Nishith Brahmbhatt,"Dharmesh Vyas, Jagruti Thakore",,
Repair 'N Despair,None,8,Short,,2016,,,,
The Trust,None,,"Short, Thriller",,2017,Shekhar Ramesh Mishra,"Alina Baksh, Vikas Burman, Ratnakar Nadkarni, Santosh Pillewar",,
Mathaduva Kaigalu,None,98,Drama,,2019,Hemantha Kumar,"Divya, Jayanth Gowda, Manjula, Ravi Nakkundi",,
Manavati,None,,"Drama, Musical",,1952,Y.V. Rao,"Seeta Rama Anjaneyulu Chilakalapudi, Surabhi Kamalabai, Sriranjani, Varalakshmi G.",,
Brojaan,None,,Drama,,,,,,
Achin Priya,None,,None,,1938,,Dhirendranath Ganguly,,
Devudichina Koduku,None,,None,3.8,1980,K.S.R. Das,"Anjali Devi, Sridevi",,10
Dying Art of the Bahurupis of Bengal,None,,Documentary,,,,Rajaditya Banerjee,,
Iccha,None,,"Short, Drama",,2021,Dhanjit Das,"Barbee Rajkhowa, Jeet Baruah, Dhanistha Roy, Swagata Bharali",,
Dad... How Are You?,None,,"Short, Drama",,2014,"Sandeep Jha, 
Sameer Mishra",Sandeep Jain,,
Sanam Hum Aapke Hain...,None,,"Drama, Romance",5.9,2009,Ajay Ojha,"G. Laya, Gagan Kang, Jeet Goswami, Ritika Punjabi",,17
Amar Seva Sangam - Hindi Theme Song,None,3,Music,,2022,,Arin Paul,,
All This and Emptiness,None,38,"Short, Drama",,2017,Arkapravo Chaudhury,"Sourya Chowdhury, Ranjana Chaudhury, Priyanka Dey, Kallol Datta",,
Guruji Oru Vakku,Not Rated,121,None,5.9,1985,Rajan Sankaradi,"Madhu, Nedumudi Venu, Mohanlal, Ratheesh",,36
Ladki Ban Than Ke Nikli,None,,"Short, Musical",,1995,,"Shyla Lopez, Baba Sehgal",,
Bahana,None,,None,,1942,A.M. Khan,"V. Afendi, Alaknanda, Ameena, Benjamin",,
Power of Belief,None,,Biography,,2014,Sandeep Maheshwari,"Samit Gambhir, Sandeep Maheshwari, Ashok Mishra",,
Cuddly,None,,Short,,2015,Karan Shetty,"Neena Kulkarni, Shruti Vyas",,
The Ring,None,17,"Short, Drama",,2021,"Prince K. Choubey, 
Rd Prakash","Sunny Arora, Chandan Jamdade, Trupti Jadhav, Mukesh Agarwal",,
Sri Paramanandayya Sishyula Katha,None,116,Drama,,2021,,Rajesh Puli,,
The Genomusic Project,None,,Short,,2014,,,,
Semal Ki Darakht,None,,Short,,1986,,Muzaffar Ali,,
Premakku Permitte,None,,None,,1967,R. Nagendra Rao,"Kalyana Kumar, Kalpana, Rama Devi, Dinesh",,
Mangu Dada,None,,Action,,1970,Maruti,"Sheikh Mukhtar, Sujit Kumar, Faryal, Zeb Rehman",,
School Singer,None,,Music,,2009,,"G.V. Prakash Kumar, Anitha Kuppusamy",,
Bulandi,None,,Drama,,1945,Nitin Bose,"Nalini Jaywant, Ashok Kumar",,
Pawan Singh & Payal Dev: Current,None,3,Music,,2021,Mudasser Khan,"Payal Dev, Raai Laxmi, Mohsin Shaikh, Pawan Singh",,
A Dad's Hope,None,1,"Short, Family",,2018,,Bharath Potipireddi,,
Santosh Baba,None,,Adventure,,2019,,Manish Khanna,,
Aakramak Lalach,None,,"Short, Drama",,2019,Bhanu Pratap Singh,"Aaditya Pratap Singh, Bhanu Pratap Singh, Diksha Pandey",,
Gati,None,,Drama,,2000,,,,
The Captivity,None,1,Short,,2018,Kishor Laxmi Hambirrao Londhe,Pritesh Gawande,,
God Damn It!,None,7,"Short, Comedy",,2014,Sohit Khanna,"Nilesh Jadhav, Pranav Mehra, Manoj Poptani, Harinder Singh Ranawat",,
Quarter,None,23,"Short, Drama, Romance",,2018,Vishal Vijayrao Shinde,"Mahesh Jadhav, Prachi Sahastrabuddhe, Ravindra Palkhe, Sai Pisal",,
Tech Support Hotline,None,,Comedy,9.5,2021,,"Madhav Kothandaraman, Ajay Tej Thalari, Aarush Bharadwaj",,8
Aadharam,None,,None,,,Gopi Polavarapu,"Renu Sree, Surya Bharat Chandra",,
Hunger,None,,"Short, Musical",,2014,Vipin Parashar,"Sahi Dhara, Lokesh Gowda, Shiv Kumar, Hira Lal",,
Ichcher Dana (Wings of Hope),None,90,Drama,,2008,Rwita Dutta,Amina Khan,,
Entwined - The possibilities are endless,None,8,"Short, Thriller",9.2,2018,Mohan Rao,"Jyothi Nayak, Prakruthi Gowda, Shankar Ram",,9
Farishta,None,,Short,,2020,Shubhanshu Satyadeo,"Vikram Gokhale, Javed Haider, Harry Josh, Hemant Pandey",,
D E V: Shaadi (Rap Song),None,,"Short, Music",,2021,,,,
No.1 Mard,None,,Action,,1998,Jayant Paranji,"Chiranjeevi, Rachana, Rambha, Paresh Rawal",,
Tejas Kolekar,None,,Musical,,2022,,Ram Charan,,
Fate and Dreams,None,28,"Short, Crime, Drama",,2004,Mihir Desai,Puneet Dave,,
11 O'Clock,None,,None,,1948,Homi Wadia,"Aftab, Sayani Atish, Austin Ki Bachchi, Fearless Nadia",,
The Last Order,None,,"Short, Thriller",,2013,Charan Kasinadhuni,"Chethan Sivalenka, Raja Vaddiraju",,
Tamhini - The Ghats,None,,"Documentary, Short",,2018,,Amol Karambe,,
Akhand Saubhagyawati,None,,Drama,,2006,Deepak Deulkar,"Kishori Ambiye, Vikram Gokhale, Purnima Oak, Smita Oak",,
